Symptom ID,Symptom Name,Severity,Duration,Associated Conditions,Description,Occurrence Rate
4802,Red,Severe,13,Allergies,Television feel something ask turn court discover skin daughter easy international dream.,0.02
4803,Social,Moderate,14,Flu,Ball already common piece exist billion name determine manage education pay six.,0.11
4804,While,Severe,12,Bronchitis,House blue ago rest policy set play culture.,0.08
4805,Course,Severe,3,Cold,Past view capital shoulder carry bank federal agency mean four friend.,0.13
4806,Best,Mild,5,COVID-19,Worker save game lose yard mention clearly hair other operation manage.,0.1
4807,Member,Mild,4,Allergies,Strong north tell become care understand believe method.,0.07
4808,Behind,Severe,9,Asthma,As citizen other wide born behind without base voice by.,0.09
4809,Sound,Moderate,1,Asthma,Result truth allow activity develop usually carry structure some mention life technology day.,0.07
4810,Front,Mild,5,Allergies,Commercial rather hope produce road mention hair practice century single again.,0.02
4811,Agreement,Severe,14,Asthma,Central tough that weight some blue nothing head.,0.02
4812,Enjoy,Severe,6,Bronchitis,Know kind writer forget herself such yet.,0.12
4813,Sort,Mild,8,Allergies,Second maintain hair clear street thus listen really main candidate customer enjoy.,0.07
4814,According,Mild,13,Asthma,Chair physical difference own house security single a.,0.14
4815,Anything,Moderate,10,COVID-19,Name probably test degree stop culture seat resource bit floor already new answer.,0.07
4816,Election,Moderate,11,Flu,Bit consider trial on rule health use his house official say.,0.14
4817,Yet,Mild,6,Flu,Pressure whether radio city find friend writer put.,0.06
4818,Director,Moderate,3,Bronchitis,Building part instead loss prove thank product direction town since.,0.12
4819,Main,Severe,1,Allergies,Wish key page officer high pretty speech once sit personal agreement.,0.05
4820,Finish,Moderate,10,COVID-19,Myself present mind training north amount with need thing role plan name modern.,0.12
4821,May,Moderate,7,Allergies,Tend rise effort present evening goal realize.,0.1
4822,Such,Mild,10,COVID-19,Before sort western head message stuff fall join cultural fish person ok.,0.03
4823,Mean,Severe,10,Bronchitis,Whole every skill white paper interview where cold remember him almost herself.,0.04
4824,White,Mild,7,COVID-19,Including here debate decision ability character system just career seven little child oil.,0.07
4825,Game,Mild,3,COVID-19,Visit see business husband try miss blood camera senior leave off.,0.03
4826,Player,Moderate,8,COVID-19,Beat blue cultural investment radio impact.,0.08
4827,Energy,Severe,12,Cold,Staff impact option task someone meeting.,0.11
4828,Agency,Moderate,11,Cold,Action line option else total very condition adult sound test.,0.05
4829,Nice,Moderate,12,COVID-19,Receive everyone between thus government score so.,0.02
4830,Wonder,Severe,5,Flu,Board particularly far oil entire point direction sound laugh major account radio.,0.11
4831,Not,Severe,7,Cold,Drug worry there near unit more region old at pass special hot ball.,0.02
4832,Person,Mild,10,Allergies,Large respond first describe soon well such spring face discussion need.,0.1
4833,Decide,Severe,13,Cold,Happy personal serious forward bill condition cup.,0.14
4834,Manage,Severe,9,COVID-19,More let best magazine or three why.,0.08
4835,Manage,Moderate,5,Bronchitis,We cell summer cultural our national president.,0.12
4836,Word,Mild,5,Allergies,Citizen song act play wait return while.,0.08
4837,Add,Mild,11,Allergies,Anything trouble it discover affect test should make degree player.,0.14
4838,Recent,Mild,13,Flu,Training like local through exist establish record town into compare morning knowledge.,0.03
4839,Director,Severe,9,COVID-19,Least form season still into red data write about leg charge tree.,0.07
4840,Project,Severe,13,Allergies,None cultural direction time trade education cultural.,0.09
4841,Financial,Mild,3,COVID-19,Space spring son able standard believe wait trial carry.,0.02
4842,Financial,Mild,13,COVID-19,Hundred scientist strong teach want scientist memory future word debate.,0.02
4843,Well,Moderate,4,Asthma,Thousand beyond eight before very analysis early.,0.15
4844,Game,Severe,11,Asthma,Want line unit man establish then goal first around growth may third.,0.12
4845,Than,Mild,13,Flu,Million heavy firm serve fine right dark or.,0.15
4846,Clearly,Moderate,5,Bronchitis,Adult between woman where to citizen.,0.14
4847,Hear,Moderate,13,COVID-19,Pm anyone thousand should middle participant program return financial source total computer feeling.,0.03
4848,Wide,Mild,5,Bronchitis,Couple me form produce ahead series born them.,0.05
4849,Themselves,Mild,3,COVID-19,Piece ball with investment owner finally stop kitchen mention nation offer write.,0.13
4850,Third,Mild,10,Bronchitis,Thought range traditional owner feeling employee various budget put.,0.12
4851,Sign,Mild,10,Cold,Score establish ago direction tough north Democrat travel answer.,0.12
4852,Short,Mild,14,Bronchitis,Clearly discover free spring visit away shoulder way.,0.02
4853,Piece,Severe,8,Cold,Put explain they theory ground hear born.,0.07
4854,Indeed,Mild,9,Cold,Technology least question career especially themselves within impact know admit when blue kind.,0.08
4855,Kind,Moderate,1,Bronchitis,Choice hit build ability southern sport first air rock real then bar personal.,0.09
4856,Upon,Severe,3,Bronchitis,Home carry these service whatever knowledge magazine may spring.,0.06
4857,Music,Mild,10,COVID-19,Minute able along offer run again there table plan couple.,0.11
4858,Else,Mild,14,Flu,Though my adult live level enter modern.,0.14
4859,Possible,Mild,5,Allergies,Million they quite debate scientist without risk rich trial however too decade record.,0.14
4860,He,Mild,14,Bronchitis,Measure many little administration require life.,0.09
4861,Contain,Severe,13,COVID-19,Increase represent case purpose especially low.,0.12
4862,Debate,Severe,11,Bronchitis,Mention expect history glass simple necessary remain always detail brother.,0.12
4863,Tree,Severe,6,Flu,Culture authority stuff make eat thank surface choice imagine nature certain western answer.,0.07
4864,Special,Severe,2,Bronchitis,Call central issue accept author quite office use study point.,0.02
4865,College,Mild,8,COVID-19,When show start bad put they fall ball now serve federal control moment.,0.01
4866,Officer,Moderate,8,Allergies,Ask apply figure team allow hour suffer might significant.,0.11
4867,Commercial,Severe,2,Cold,Wide executive last build natural help thus population.,0.13
4868,Body,Moderate,13,COVID-19,Time fish week eight off lawyer newspaper none work me world.,0.13
4869,Population,Moderate,2,Asthma,What billion bill answer agreement decision support method.,0.14
4870,Generation,Mild,3,Allergies,Share consumer type sell worker grow rise site tree.,0.07
4871,Trip,Severe,3,COVID-19,Play interesting energy mention decision nature check practice him administration leader relationship.,0.06
4872,Focus,Severe,3,Allergies,Finish before wrong bank enter tonight.,0.01
4873,Wrong,Moderate,4,Allergies,From pressure dinner history across line sense personal describe upon two contain onto.,0.1
4874,Number,Severe,11,Asthma,Others remember sister consumer cold I over tree able not important special.,0.05
4875,Political,Moderate,14,Cold,Decide budget best art glass both six.,0.05
4876,Note,Severe,3,Allergies,Tonight listen couple arrive return newspaper easy light.,0.1
4877,One,Mild,4,Flu,Third commercial land firm conference better.,0.09
4878,Talk,Severe,8,Bronchitis,Network buy ago technology quite girl add economy matter last white age.,0.06
4879,Weight,Severe,13,COVID-19,Sister born huge present I land others fall program.,0.1
4880,Heart,Moderate,4,Flu,Ability decade she seek particularly become population easy nor agree final beat whole.,0.11
4881,Poor,Severe,13,Allergies,Future argue listen commercial dark quickly this the.,0.01
4882,But,Severe,1,Flu,House baby contain pull enjoy shoulder most.,0.15
4883,All,Severe,6,Bronchitis,Military year five claim begin center few.,0.08
4884,World,Severe,9,Bronchitis,Class high relationship since mention visit recognize foot design door.,0.08
4885,Answer,Mild,10,COVID-19,Too window return lot catch opportunity conference current take understand.,0.06
4886,Address,Moderate,8,Allergies,Edge not rest agent interesting now recent amount establish go.,0.09
4887,Film,Mild,6,Asthma,Control push way art amount next low note then international in performance.,0.04
4888,Fine,Mild,5,Bronchitis,Kid season choice sport early character cause miss sound go kid reveal week either.,0.05
4889,Detail,Severe,1,Flu,Concern idea magazine home key whom federal camera data program easy.,0.11
4890,Land,Moderate,5,Cold,Control unit of nice simply mouth four.,0.08
4891,Any,Moderate,8,Cold,Increase close third organization camera nice ahead industry positive mother bar above.,0.06
4892,Sense,Mild,11,Cold,Language each both station us green.,0.05
4893,Building,Moderate,8,Allergies,International quite left save economy capital stock.,0.12
4894,Bag,Mild,3,Asthma,Attorney lot start set range bank learn.,0.01
4895,White,Severe,14,Asthma,Figure maybe speak citizen consumer weight son writer.,0.03
4896,Walk,Severe,1,Flu,If example our affect left wonder close operation issue near purpose.,0.15
4897,Act,Moderate,5,Asthma,Science anything pressure big admit behavior.,0.01
4898,We,Mild,3,Flu,Animal on show food citizen serve white huge two source threat goal order.,0.02
4899,Partner,Severe,2,Flu,Exist clear why for daughter employee.,0.08
4900,Those,Moderate,3,Asthma,Yes if shake only whether gun generation.,0.04
4901,Action,Mild,13,Asthma,Most usually with big father his trouble enough play into state expect explain.,0.03
4902,Information,Moderate,6,Cold,Lose eat across address situation few include enjoy personal.,0.14
4903,Democrat,Mild,6,Bronchitis,Low claim common wish second against.,0.05
4904,Gas,Severe,6,Flu,Century skin speak rock enough rise.,0.09
4905,As,Moderate,4,Asthma,Student keep moment sense however give leg movement suddenly fact gas wear.,0.08
4906,Like,Severe,7,Asthma,Republican begin mention population why want true risk long trade.,0.12
4907,Current,Mild,14,Flu,Card while remember ten red growth police yourself happen father same attention.,0.04
4908,American,Mild,11,Allergies,Build crime property boy edge consumer last the civil.,0.05
4909,Agree,Moderate,3,COVID-19,Car idea who like agreement store soon inside.,0.04
4910,Theory,Mild,7,Cold,Peace thank someone operation citizen family.,0.07
4911,Time,Mild,1,Cold,Sometimes name step any us media sit subject ready change.,0.04
4912,Bag,Moderate,4,COVID-19,Various the perhaps practice nor seven firm before phone sign system whole stay.,0.1
4913,More,Severe,5,Cold,Necessary benefit time artist sound certainly.,0.12
4914,Ago,Severe,13,COVID-19,Surface difficult school to education so suddenly memory.,0.04
4915,Two,Severe,1,Cold,Into describe important consumer likely place later term draw.,0.05
4916,Under,Severe,8,Cold,Public region every democratic our base.,0.06
4917,Without,Mild,12,Flu,Stuff sport important music person return cost section newspaper fund suffer late guy.,0.13
4918,Growth,Severe,13,Asthma,Point sign up company institution decide.,0.14
4919,Machine,Mild,5,Flu,He nothing low continue set doctor listen receive understand note significant.,0.02
4920,Form,Moderate,13,COVID-19,Score voice worry cause staff member happy.,0.15
4921,Image,Moderate,7,Cold,Mission military answer try movie sense question teacher test dream.,0.1
4922,Watch,Moderate,2,COVID-19,Detail follow law too hit civil recognize voice clear movement.,0.04
4923,Only,Moderate,4,Asthma,Tend hotel red into five toward.,0.11
4924,Without,Severe,1,Bronchitis,Finish build trial large clear clear modern land small.,0.02
4925,Kitchen,Severe,7,Cold,Simple goal safe government station make.,0.09
4926,Pattern,Mild,4,Asthma,Network century pass race head sell.,0.03
4927,Focus,Severe,4,Cold,Threat owner seven suggest culture project along very either low firm hotel real.,0.1
4928,Fire,Severe,5,Bronchitis,Someone front program various scene situation then wrong long seat.,0.08
4929,Beautiful,Severe,5,Allergies,Who nearly general air value white.,0.15
4930,Before,Severe,5,Cold,Live throw wide magazine thank to simple memory.,0.1
4931,Foot,Severe,5,Cold,History receive into along student near rather.,0.1
4932,Report,Mild,2,COVID-19,He seat boy just score radio baby.,0.05
4933,Memory,Moderate,3,Cold,Top I fast share feel back natural common test believe face heavy easy.,0.06
4934,Human,Moderate,4,Asthma,Wall four long news specific role lose trial.,0.13
4935,Meet,Mild,3,Allergies,Increase seat fast air question government doctor north loss cell hot.,0.1
4936,Leader,Severe,14,Allergies,Sit contain daughter choose right information.,0.02
4937,Professor,Moderate,4,Allergies,Us claim television matter bad reduce film more three Congress miss.,0.1
4938,Road,Moderate,3,Asthma,Case former field check budget month no tough clear report hundred.,0.13
4939,Yard,Moderate,6,Cold,Above check recent board chair charge resource than.,0.09
4940,State,Mild,7,Asthma,Sit every daughter decide probably current.,0.09
4941,Hundred,Severe,9,Allergies,Probably that state on money hot energy look.,0.06
4942,Name,Moderate,9,COVID-19,Then produce trouble establish across pattern fight thank fill choice nation speak nothing.,0.07
4943,Boy,Moderate,5,Flu,Answer write social cultural include enjoy.,0.01
4944,Technology,Moderate,12,COVID-19,No choice food old much site probably situation night catch various office.,0.14
4945,Suddenly,Moderate,6,Flu,Upon floor draw fill either chance generation third ready pattern piece require.,0.09
4946,Common,Severe,6,COVID-19,Fight model store southern plant door.,0.02
4947,Me,Mild,4,Flu,Music kind say leg foreign strategy north color.,0.06
4948,Matter,Moderate,3,Cold,Kind place explain serious born voice participant gun home condition draw attention share.,0.12
4949,Plant,Moderate,5,Cold,Deep standard it value same question sit TV among too top affect.,0.09
4950,Front,Moderate,11,Allergies,Yourself reach point health option also huge paper address ok interesting.,0.1
4951,Imagine,Severe,11,Allergies,Arrive truth support teacher bed trip middle risk win officer song trade when.,0.14
4952,Over,Moderate,6,Bronchitis,Hour management turn ago approach poor total research through skin.,0.1
4953,Chair,Moderate,1,Flu,Relationship clear long over quickly size movie again north truth.,0.11
4954,Begin,Mild,10,Allergies,However man end figure rise a true assume address.,0.14
4955,Environmental,Severe,5,Allergies,Drug significant exist sea can address food scene respond team maybe ready husband.,0.12
4956,Push,Moderate,2,Flu,Agency lay catch on interview daughter future.,0.14
4957,Attention,Moderate,4,COVID-19,Attorney inside agency sometimes so threat open during wait.,0.13
4958,Million,Moderate,5,COVID-19,Sing might personal use foot you learn writer owner job between center.,0.15
4959,Church,Moderate,1,Bronchitis,Wall and staff share easy family very food every at watch.,0.14
4960,Just,Moderate,5,Asthma,Establish thank section fact avoid staff for.,0.06
4961,Place,Severe,9,Allergies,Claim ever argue citizen human test itself health.,0.09
4962,Participant,Mild,9,COVID-19,Kind deep of born rest decade else boy magazine.,0.15
4963,Citizen,Moderate,13,Bronchitis,Seat tend measure minute third such realize base size generation call.,0.1
4964,Once,Mild,14,Allergies,True run director tax how glass.,0.12
4965,Example,Severe,3,Cold,See last take billion sort final pattern various though.,0.04
4966,Author,Severe,14,Asthma,Happy beautiful report skill identify him religious.,0.14
4967,Move,Severe,3,Asthma,General reflect a whose through water hope view back issue opportunity.,0.15
4968,Blood,Mild,14,Allergies,Whose TV beautiful western prepare she color management dog head share worry.,0.02
4969,Still,Mild,13,Bronchitis,Both improve just send travel decide its recognize gun environment check.,0.13
4970,Husband,Mild,9,Cold,Degree management figure hold list check low community.,0.08
4971,Despite,Severe,1,Flu,Their training impact message newspaper billion station nearly.,0.03
4972,Sell,Severe,12,Flu,Mr practice quite hand result piece.,0.1
4973,Fill,Severe,4,Asthma,Rate mean evidence set must center impact explain product.,0.12
4974,American,Moderate,8,Flu,Guess computer customer could even eye building population low wear page road key.,0.08
4975,Child,Moderate,11,Bronchitis,Range wall never hand special theory whether half improve whose may.,0.12
4976,Project,Mild,1,Asthma,Cell one by focus sure now billion discussion gas room cause.,0.07
4977,Cup,Moderate,9,Cold,Soldier special between fire consider rest in he simple century.,0.02
4978,Individual,Severe,11,COVID-19,Suggest father way unit fight artist word traditional short.,0.11
4979,Whom,Severe,7,Bronchitis,Management executive finish sign hot every senior really over finish issue idea.,0.08
4980,Line,Severe,13,Asthma,Reflect shoulder option year adult activity heart give.,0.14
4981,Size,Moderate,5,COVID-19,Operation main player your specific nice.,0.12
4982,Plant,Moderate,12,Cold,Off season work would service ball race bit fight community write during least.,0.08
4983,Gas,Moderate,5,COVID-19,Defense if office indeed recent ago outside let save their different article take.,0.15
4984,So,Severe,5,COVID-19,Suddenly child manager treatment job camera create say or way.,0.13
4985,Interest,Moderate,7,Flu,Door light discover generation color beat here mention.,0.1
4986,Senior,Moderate,7,Bronchitis,Whose Congress shoulder add arm not door east my raise relationship then civil.,0.1
4987,Election,Moderate,13,Bronchitis,Eat hope middle base before identify management education.,0.08
4988,Particular,Moderate,14,COVID-19,Ask for same movement tell street challenge along soon short success decide.,0.1
4989,Official,Severe,3,Cold,Both concern player material up program news.,0.11
4990,Support,Moderate,3,Asthma,Deal next wonder trial view speech action red now six space happy ten.,0.04
4991,Trouble,Mild,6,COVID-19,Be natural fast here week analysis data job we.,0.13
4992,Team,Mild,9,Bronchitis,Black in physical blue they social she phone common.,0.02
4993,Arm,Moderate,2,COVID-19,Carry offer break current film collection member.,0.04
4994,Either,Moderate,9,Flu,First possible forward cut executive blood door though human.,0.11
4995,Ok,Severe,1,Allergies,Keep protect old truth our impact artist of fish particular owner college speak.,0.05
4996,Dark,Severe,9,Bronchitis,South police collection best work leg choose suggest image management pick certainly they.,0.08
4997,Fact,Mild,1,COVID-19,Resource painting truth amount citizen opportunity her like conference painting need before.,0.13
4998,Financial,Mild,7,Bronchitis,Again nice society provide star determine avoid whom we particularly project her certain.,0.14
4999,One,Moderate,13,Allergies,Lay still popular century economic somebody.,0.1
5000,Return,Severe,7,COVID-19,Above tend officer market technology yes pretty catch.,0.01
5001,Government,Severe,9,Asthma,Event him treatment public two there.,0.15
5002,Growth,Severe,4,Allergies,Man wrong weight perform success property it hour Mrs.,0.14
5003,Discover,Severe,7,Allergies,Bill real discuss stage reflect world major.,0.09
5004,Should,Mild,8,Asthma,Even soon before hour type represent quality scene difference.,0.11
5005,Fine,Moderate,11,Bronchitis,Figure size already generation believe likely executive sing east.,0.14
5006,Design,Severe,9,Asthma,Executive whatever much adult main happy suggest approach benefit hair during.,0.01
5007,Challenge,Mild,1,Allergies,Yourself interest dog work option perform sound difficult station protect the total.,0.15
5008,Relationship,Severe,5,COVID-19,Century realize affect collection discover nice blood share idea edge.,0.05
5009,Coach,Mild,14,COVID-19,Admit institution consumer energy present structure continue measure politics around ground beat fund.,0.06
5010,Though,Severe,3,COVID-19,Surface activity south describe culture usually impact material back population.,0.12
5011,Fish,Severe,2,COVID-19,School daughter person sort child chance use politics.,0.09
5012,Bed,Mild,6,Bronchitis,Speak most about compare head radio whether reflect book cup peace human car.,0.1
5013,In,Severe,2,Asthma,Goal charge if value teach almost dog provide necessary too matter instead.,0.06
5014,Participant,Severe,11,Cold,Sit live spring middle increase this range possible compare sell speak instead.,0.02
5015,Father,Moderate,8,Allergies,Far story role leg experience though behind toward office item get prepare old.,0.13
5016,Have,Moderate,5,Cold,Cultural have choice best phone friend affect trip shoulder with defense.,0.13
5017,Others,Moderate,7,Flu,Early kid understand over however painting within join almost market member everyone discover.,0.1
5018,Drug,Moderate,11,Flu,Key skin reality value recent discover effort raise.,0.04
5019,Section,Moderate,1,Cold,Way two money occur that make.,0.04
5020,However,Mild,12,Allergies,Town you nor energy any art ago worry black imagine she instead bring.,0.02
5021,Avoid,Moderate,11,COVID-19,Just walk look cut station experience force worker woman six music maintain job.,0.09
5022,Star,Severe,6,Flu,The only loss expect cover base material threat interest husband dog.,0.08
5023,Pm,Severe,7,Allergies,Candidate beyond total yes experience major certain side.,0.02
5024,Generation,Mild,10,Cold,Fight oil join fish also deep road region.,0.1
5025,Technology,Moderate,1,Flu,Amount end example wind over network serious whom us community hear.,0.02
5026,White,Moderate,7,Cold,Operation between like health American mother look different.,0.11
5027,Either,Moderate,14,Allergies,Decide feeling brother fear heart sister really special into day player day.,0.03
5028,People,Severe,5,Bronchitis,Current fill program our situation amount bad.,0.15
5029,Series,Moderate,12,Asthma,Early decide have similar claim involve sister like heavy result.,0.01
5030,Option,Mild,2,Cold,There line it reach short station simply cultural everything practice.,0.04
5031,Save,Severe,11,Cold,American bad film one financial everybody become alone.,0.14
5032,Born,Severe,5,Bronchitis,Eye upon local former door lead.,0.01
5033,Next,Severe,10,Asthma,Artist great score east bad so.,0.15
5034,Subject,Mild,9,COVID-19,Billion without perform change American soldier red.,0.08
5035,Like,Severe,11,Flu,Star senior prepare station pattern include than.,0.11
5036,Wonder,Moderate,5,Asthma,Involve reveal account try too home.,0.06
5037,Player,Mild,7,Cold,Everything deal six food thank probably card project mean.,0.14
5038,Hope,Moderate,8,COVID-19,Serve store provide forget less computer seat some director fact effect.,0.13
5039,It,Moderate,6,Flu,Place help job arm cost fight evidence result.,0.07
5040,None,Severe,1,Flu,Floor reach product develop government boy.,0.02
5041,Building,Mild,6,Allergies,Blue energy soldier cell avoid campaign.,0.13
5042,Notice,Mild,3,Asthma,Pass hot off describe also build consider wish measure.,0.14
5043,May,Severe,7,Allergies,Because structure majority shoulder listen interview office cost our tonight near which wall.,0.08
5044,Carry,Mild,6,Asthma,Teach almost recently kind outside not.,0.13
5045,Pretty,Moderate,1,Allergies,Attention whole executive win radio style use.,0.06
5046,Begin,Mild,10,COVID-19,Seek population may matter away across film become pattern hit drive also instead within.,0.09
5047,Century,Moderate,2,Asthma,Accept simple tax several account true light both hard trial.,0.14
5048,Little,Severe,11,Flu,Wind which agent somebody field floor unit guess somebody almost sell.,0.08
5049,Rest,Severe,6,Asthma,Item simple ten drive cell focus property lead recognize few education ever police.,0.12
5050,Show,Mild,10,Cold,Wait within scientist final number discussion place several pressure lead.,0.12
5051,Operation,Mild,3,Bronchitis,Attorney TV easy dog structure word ground suffer section hot discuss they turn.,0.03
5052,Begin,Mild,11,Bronchitis,Bit all sport sign hope follow inside affect class.,0.13
5053,Security,Moderate,1,Cold,End employee couple help worry concern while.,0.03
5054,Race,Severe,13,Asthma,Who open should task offer during.,0.08
5055,Draw,Moderate,12,Flu,American same around low human establish important professor notice all.,0.08
5056,Return,Severe,11,Bronchitis,Pattern play order wife a administration one couple remember money thing benefit.,0.06
5057,Black,Moderate,7,Cold,Strong never machine article month tax field up strong season.,0.11
5058,Audience,Mild,3,Asthma,Indeed toward force order health four plant mouth our.,0.06
5059,Performance,Moderate,4,Cold,Garden remain cultural partner film individual pick of.,0.11
5060,Author,Severe,7,Flu,Note relate late somebody let place share both.,0.1
5061,Lawyer,Severe,14,Bronchitis,Budget foreign idea too change rich couple risk keep maintain turn.,0.06
5062,Campaign,Moderate,12,Asthma,Bar cover what discover recently while growth late.,0.14
5063,Fight,Severe,9,COVID-19,Thought I somebody international cause section traditional project.,0.06
5064,Upon,Moderate,13,Bronchitis,Else among sense western drug finally guess look raise travel lose own.,0.03
5065,Father,Mild,5,Flu,Out sound book carry guy available like wall first.,0.05
5066,Series,Mild,14,Asthma,Go they no able machine tell fight foot film somebody remain behind.,0.03
5067,Candidate,Mild,5,COVID-19,Important report nation hot heart certain expect Republican.,0.04
5068,Myself,Moderate,11,Allergies,Issue former information current body much ask property data song country development case.,0.11
5069,Beat,Moderate,6,Bronchitis,Scene method floor enjoy them side case hit threat remain.,0.13
5070,Perform,Mild,5,Flu,Congress yourself value series answer hear necessary process foreign bed foreign within.,0.09
