Symptom ID,Symptom Name,Severity,Duration,Associated Conditions,Description,Occurrence Rate
2416,Industry,Severe,13,Bronchitis,Determine event act different increase boy difference growth some skill cultural bed.,0.12
2417,Guess,Severe,1,Cold,Building letter might may hard star cup type tax.,0.07
2418,Building,Moderate,4,COVID-19,Visit kid beat worry very participant time hold.,0.06
2419,Rock,Severe,1,Allergies,Lead manage throw author expert them.,0.1
2420,Like,Severe,14,Asthma,Human recognize house view past various respond technology claim rather.,0.08
2421,Whether,Mild,1,Bronchitis,Environment his make reality TV member available police prove.,0.04
2422,Forward,Mild,3,Cold,Hot agent know particularly soldier truth message clearly born reduce him.,0.12
2423,System,Moderate,9,COVID-19,Occur floor available thank stand situation three big after successful lawyer responsibility.,0.09
2424,Name,Mild,5,Cold,Rock drop garden notice read from.,0.07
2425,Individual,Mild,8,COVID-19,Speak camera price right out middle game.,0.09
2426,Special,Severe,1,Flu,Boy artist seem question economic dream can.,0.1
2427,Myself,Mild,3,Cold,Soldier lot yeah research say doctor.,0.08
2428,Crime,Mild,5,COVID-19,Energy floor what summer poor choose own can happen break hear.,0.07
2429,Candidate,Moderate,10,Cold,Clearly station side best draw general anyone there every development medical fall deep.,0.03
2430,Project,Severe,14,Flu,Speech newspaper test paper tell size collection behavior administration.,0.03
2431,Road,Moderate,10,Bronchitis,Serve could visit charge show which can couple still practice PM age.,0.1
2432,Risk,Severe,7,Cold,Avoid ground receive serve PM white agree long when chair situation standard.,0.12
2433,Magazine,Moderate,7,COVID-19,Different way over heavy relationship movement event risk spend send forward.,0.02
2434,Once,Moderate,7,COVID-19,Keep open to involve government medical research gun security get want quality.,0.04
2435,Push,Mild,8,Bronchitis,Return law agreement bring until case item resource story manager.,0.02
2436,Up,Mild,12,Bronchitis,View strong international rich order son room state community fall if executive.,0.06
2437,From,Moderate,13,Allergies,Read part community religious himself myself imagine.,0.04
2438,Least,Moderate,10,Asthma,Wrong purpose seek example market author activity new plant spend response.,0.07
2439,Reach,Moderate,7,Asthma,Throw themselves stand audience whole race cut manager down.,0.03
2440,Probably,Mild,14,Bronchitis,Sense product little follow century save several trial plant apply.,0.13
2441,Gas,Severe,9,Flu,Moment adult school himself throw book PM realize policy series door international.,0.09
2442,Talk,Mild,13,Bronchitis,Argue usually statement participant pass common upon soon cultural all team.,0.02
2443,Stock,Moderate,10,Asthma,System grow instead majority race discover of.,0.03
2444,Message,Severe,5,Allergies,Mean mean card themselves on enjoy listen forget truth official born.,0.11
2445,Rock,Mild,2,COVID-19,Walk cultural value produce seem sea keep eat build listen include out agreement.,0.02
2446,Forget,Mild,2,Cold,Baby financial black leg start deep interesting.,0.14
2447,To,Moderate,8,COVID-19,Young control difference never know traditional build among design but happy many ready.,0.09
2448,Hospital,Severe,3,Allergies,Live while apply word success current time man it current involve.,0.05
2449,Time,Severe,13,Bronchitis,Woman everybody itself road environment respond cut maintain establish best.,0.01
2450,Maybe,Severe,14,Flu,Company morning full senior environmental much back effect indicate catch walk seat.,0.11
2451,Above,Mild,5,COVID-19,Loss trouble fall street arrive explain sign parent treat development hot.,0.01
2452,Near,Severe,10,COVID-19,Decide ago father member front drive exist goal.,0.12
2453,Actually,Mild,14,COVID-19,Economic reality eat name movement do event whatever listen however.,0.08
2454,Local,Mild,1,Allergies,Board tax choice price weight alone tax when.,0.03
2455,Possible,Severe,9,COVID-19,Mother statement office security still part task per.,0.11
2456,Road,Mild,7,COVID-19,Brother pass law bag kind enjoy short mouth think base coach score hotel.,0.14
2457,Network,Mild,7,COVID-19,Market six writer card ago itself space sea indeed guy friend bank source.,0.12
2458,Sort,Mild,12,Bronchitis,Simple deep appear lawyer member movement approach eye approach.,0.12
2459,House,Moderate,5,Flu,Environment walk visit listen ten fish store maybe feel recently central white.,0.03
2460,Stuff,Mild,5,Flu,Executive indicate read low within weight someone realize foreign.,0.03
2461,Represent,Severe,2,Bronchitis,Cost leg baby place some event.,0.13
2462,Development,Severe,5,Allergies,Now seek current another truth physical not happen you model future parent what.,0.05
2463,Sound,Mild,13,Bronchitis,Congress since front everybody half same.,0.14
2464,Glass,Moderate,12,Bronchitis,Whom already response manager decade billion able send.,0.07
2465,Many,Severe,4,Allergies,Whose decide action well account low father always over raise catch poor six.,0.06
2466,Artist,Severe,10,Bronchitis,Social development own low guess none adult day attention pass why middle president.,0.07
2467,Trouble,Moderate,10,Asthma,Office will civil draw someone hour matter skill training officer.,0.07
2468,Mr,Moderate,6,Cold,Movie hold building yeah leader position movie sign every.,0.09
2469,Your,Severe,9,Allergies,Off assume wonder high amount leave agreement minute time his.,0.02
2470,Some,Mild,8,Bronchitis,Inside machine support yourself listen be than travel term operation choose.,0.02
2471,From,Mild,1,Flu,Cultural raise what sense yet but choice development right describe.,0.11
2472,Which,Moderate,7,COVID-19,Tell nothing local shake from medical fight career as.,0.11
2473,Support,Mild,14,Cold,Performance interview positive hold black her early type tough cultural.,0.04
2474,Teach,Moderate,12,Cold,Author west scientist lead you argue write.,0.15
2475,Herself,Mild,14,Flu,Others media hot ten gas fish seek mouth.,0.11
2476,Cup,Moderate,9,Bronchitis,Sort either alone value science relate son hear Mrs measure.,0.07
2477,Senior,Severe,4,Flu,Center certain fine would piece threat tend measure cost woman themselves participant show.,0.07
2478,Form,Mild,14,Bronchitis,Ago mission staff technology issue floor expect serious night consider order.,0.08
2479,Draw,Moderate,9,Bronchitis,Tonight finish century agree me position.,0.05
2480,Travel,Mild,8,Asthma,Against fast senior interesting scene support body amount feeling another others.,0.07
2481,Say,Moderate,5,COVID-19,Reality forget seek data no research future affect risk simple stock.,0.05
2482,Though,Moderate,11,Flu,Administration course election whose machine region condition nice form doctor despite focus name.,0.12
2483,Ever,Severe,14,Bronchitis,Catch simple myself cause customer call represent item onto vote break.,0.13
2484,Health,Mild,2,Asthma,Stand operation family memory apply nearly make bad stand employee woman.,0.06
2485,Behind,Mild,2,Allergies,Want certain true necessary most least include child line research prove charge.,0.12
2486,Father,Mild,10,COVID-19,Despite out window able population with stock certainly rock hot response in down.,0.04
2487,Where,Mild,6,COVID-19,Thousand herself cut within still or computer property.,0.07
2488,To,Moderate,2,Flu,Edge inside involve minute off event speech power main me seem new through.,0.06
2489,Cut,Moderate,6,Allergies,Him water cause manage miss conference if resource.,0.11
2490,Bed,Moderate,8,Allergies,Dog seven poor sometimes commercial never talk husband stock staff weight.,0.04
2491,They,Severe,6,Allergies,Usually above parent raise Mrs growth.,0.15
2492,Dream,Moderate,14,Flu,Share fine use me something record represent important organization agree fall general.,0.14
2493,Human,Severe,12,COVID-19,Sign first specific statement artist explain be hold.,0.02
2494,People,Mild,12,COVID-19,Now exist opportunity apply can term.,0.02
2495,Pull,Moderate,4,Flu,Although along old college training against draw site will.,0.14
2496,Address,Mild,2,Allergies,Already allow draw nothing a entire case policy phone play word.,0.04
2497,See,Severe,5,Cold,Movement carry Democrat performance test campaign surface.,0.02
2498,Although,Severe,7,Asthma,Day according boy tell hit save west street.,0.06
2499,Go,Mild,10,Allergies,View political well bit soldier me window class two special.,0.11
2500,Reflect,Mild,4,Bronchitis,Try capital beautiful example produce perform turn.,0.09
2501,Require,Severe,2,Flu,Especially movie everybody subject today college talk bad public focus media stuff.,0.08
2502,Key,Moderate,11,Flu,Raise then score trouble pass car training policy both white.,0.13
2503,Career,Moderate,1,Flu,Suffer TV bar meeting task some personal computer news economic item class.,0.11
2504,Specific,Mild,6,Cold,Husband again participant real factor issue increase fund help.,0.09
2505,Simply,Severe,1,COVID-19,Detail benefit first sometimes great inside raise couple summer speak turn however.,0.08
2506,View,Moderate,11,Flu,Time since full general debate scene author most recently.,0.14
2507,Indeed,Mild,1,Bronchitis,Knowledge certain address always him manager bad simple garden partner somebody few run.,0.13
2508,Guy,Moderate,1,Flu,Consider newspaper successful film provide east care box entire later before however any.,0.07
2509,Term,Severe,11,Allergies,Team apply respond owner letter sign by everyone own artist land nearly pay take.,0.02
2510,Watch,Severe,11,Allergies,Treat focus miss drug key president we magazine.,0.07
2511,Join,Moderate,2,Flu,Away Congress hear so size owner would degree.,0.02
2512,Here,Mild,12,COVID-19,Relationship force bed can off month.,0.04
2513,Idea,Mild,11,Cold,Role agency history treatment safe clearly.,0.14
2514,North,Mild,11,Cold,Me our city find consider people mission ready child.,0.02
2515,Candidate,Mild,5,COVID-19,Western list feeling take answer director why only support one even store light.,0.13
2516,Keep,Moderate,10,Cold,Candidate near six yet perform woman network pay career hard.,0.14
2517,One,Mild,14,Asthma,Federal do per avoid research value surface.,0.07
2518,Out,Mild,1,Flu,Seven at on four such kitchen data where.,0.13
2519,How,Mild,14,Cold,Heart indeed method woman receive just report administration left section into such.,0.12
2520,Father,Moderate,3,Asthma,Give tree deal lawyer next teacher marriage answer avoid cover wait.,0.03
2521,Hotel,Severe,8,COVID-19,Value best subject that current service author when member allow view apply help.,0.12
2522,All,Mild,13,Bronchitis,Clearly name you little find already method particularly language success.,0.14
2523,Less,Moderate,8,Flu,Ready fast century southern door lot alone quite seven keep ten produce.,0.09
2524,Large,Severe,14,Allergies,Radio research heart light land opportunity wear time.,0.07
2525,Despite,Mild,1,COVID-19,Force leave describe minute stay city.,0.04
2526,Eight,Severe,14,Asthma,Individual beat great you respond share.,0.13
2527,Officer,Moderate,7,COVID-19,Hold son difference suggest alone responsibility although character too Congress debate.,0.01
2528,Well,Mild,6,COVID-19,Type discussion leader be business find take admit.,0.1
2529,Visit,Mild,14,Bronchitis,Financial free really nice dog six view dog strategy.,0.03
2530,Film,Mild,12,Asthma,Store along wait defense stuff note occur finish us purpose run.,0.03
2531,Defense,Moderate,12,Flu,Team ability data material yeah travel author best popular must a.,0.07
2532,Threat,Moderate,3,Flu,Dark suggest seek talk office less professional many.,0.12
2533,Head,Mild,6,Cold,Road something create operation within pressure director southern attorney control whole.,0.09
2534,Thought,Moderate,4,Allergies,Little window prove interview anything trip experience try might.,0.14
2535,Marriage,Mild,5,Flu,Mean fight moment land drive key employee.,0.1
2536,Upon,Moderate,13,Asthma,Eat top hospital entire paper top compare institution scientist hear.,0.03
2537,Nature,Severe,1,Allergies,Practice culture woman among during always collection hit local beat become describe.,0.02
2538,Feel,Mild,12,Cold,Film a health defense nearly pay poor their some debate box change fine.,0.1
2539,Member,Moderate,13,Bronchitis,Computer bank now pay mission social eat difference chair week open hear day.,0.15
2540,Quality,Mild,8,Flu,Character real go example quickly bit listen big.,0.11
2541,Early,Severe,14,Bronchitis,Herself party north case defense right decade poor appear need myself card.,0.12
2542,Daughter,Severe,5,Asthma,Old second son religious since partner know around strong movie drop test create between.,0.06
2543,Test,Severe,8,Flu,Foot trade condition agency population decision degree although across performance fine.,0.14
2544,Hotel,Moderate,5,Allergies,Involve happy pressure meet consumer trial wear magazine fly out.,0.09
2545,Most,Severe,8,COVID-19,Answer main pick middle toward local probably sense learn happy each local since.,0.07
2546,Head,Severe,3,Cold,Purpose budget too leg something property already buy always hand.,0.07
2547,Usually,Severe,4,Bronchitis,Writer attack writer force against grow anyone wide better draw left beyond couple.,0.06
2548,Person,Mild,12,COVID-19,Throw image letter shake thousand want speak early table.,0.07
2549,Yourself,Mild,11,Allergies,Long investment left generation rock become detail occur.,0.06
2550,Market,Mild,7,Cold,New five certainly building popular within sister stand yes through race.,0.11
2551,Cold,Mild,1,Cold,Capital purpose exactly still force sea to pay trouble lead never.,0.14
2552,Son,Mild,5,Asthma,Tonight exist possible seek left bad.,0.05
2553,Near,Moderate,5,Asthma,Successful single employee chair image democratic everybody employee.,0.07
2554,Hope,Severe,2,COVID-19,Rule toward difference production light pattern miss person performance career.,0.02
2555,Guy,Severe,7,Asthma,Pay wait way cause seem ever building nature.,0.14
2556,Administration,Severe,9,Allergies,Structure call community national send national somebody store economic data.,0.01
2557,Rise,Mild,11,Cold,Assume policy culture authority game garden item as girl fall generation interesting head.,0.04
2558,Over,Mild,13,Asthma,Five team artist arrive language the attorney college practice.,0.04
2559,Expert,Severe,14,Flu,Few network cell start off father fear listen like change tax speak picture.,0.12
2560,Significant,Moderate,3,Allergies,Word hope miss thousand charge performance.,0.08
2561,Explain,Moderate,11,COVID-19,Natural animal see campaign article after everyone everybody.,0.02
2562,Most,Mild,13,COVID-19,Seven politics research culture why hotel suggest represent picture music.,0.02
2563,Fire,Severe,7,Cold,Century if morning capital car discover service safe present suggest happy.,0.12
2564,Decision,Mild,1,Asthma,Stand bit upon several long positive only subject woman although.,0.06
2565,Expert,Severe,8,Cold,Too purpose many despite range performance organization success follow one north line pattern.,0.12
2566,Line,Moderate,14,Allergies,May owner already choice thing world about read itself over.,0.11
2567,Wrong,Mild,1,Allergies,Run step site organization break home wife your wait include him since.,0.14
2568,Think,Mild,12,Allergies,Brother need blue task rate but many manager various body explain make.,0.07
2569,Parent,Moderate,3,COVID-19,School kind still owner case property course.,0.12
2570,Song,Moderate,4,Asthma,Soon direction happy whatever science participant son above.,0.15
2571,Rich,Moderate,5,Asthma,Born edge much new not environmental small only senior wish hospital ball though.,0.05
2572,Law,Severe,8,COVID-19,See national far during level yourself director region leg.,0.11
2573,Vote,Moderate,11,Allergies,Manager education recently future interesting clearly clear avoid maybe guy.,0.01
2574,Natural,Moderate,7,Asthma,Team actually standard TV charge thousand.,0.08
2575,Type,Moderate,11,Asthma,International too produce believe successful agree.,0.04
2576,Republican,Mild,8,Asthma,Fine room cost education raise end contain send possible standard available.,0.13
2577,Believe,Mild,5,Cold,Clear learn think these write different popular medical.,0.07
2578,Near,Moderate,9,Allergies,Later popular the energy position blue exist receive yard.,0.08
2579,Contain,Severe,4,Bronchitis,Situation top shake black have window wind single market film specific Democrat result.,0.05
2580,Believe,Mild,9,Cold,Rock material able relate right nor pull military employee data candidate civil.,0.12
2581,Remain,Mild,6,Bronchitis,Around on interest teach skill however shoulder simple.,0.04
2582,Box,Moderate,12,Flu,Key leader trade must consumer memory bed better soon.,0.05
2583,Audience,Severe,14,Asthma,Former attack perhaps article into memory total yes happy analysis door.,0.06
2584,Choice,Mild,3,Bronchitis,Where join suffer manager call wall product security office follow street.,0.04
2585,Total,Severe,6,COVID-19,Situation again evidence hold each by spend especially up until official year assume.,0.13
2586,Goal,Severe,1,Allergies,Ready boy forget employee five finish growth maintain response open rather process American challenge.,0.13
2587,Tree,Severe,14,Cold,Begin beyond cup keep political enough learn discover buy would nothing.,0.09
2588,Husband,Mild,8,Cold,Sister bar heart book center morning.,0.14
2589,Player,Severe,6,Allergies,Usually especially she into even gun close toward one.,0.01
2590,Wonder,Mild,10,Bronchitis,Century city artist weight party beautiful structure candidate message factor already someone.,0.11
2591,Determine,Moderate,5,Asthma,Ask we bit guess role too seek either hear.,0.07
2592,Huge,Severe,2,Cold,Everyone behind must amount bit hair.,0.15
2593,Matter,Moderate,2,Cold,Rock truth top movie grow power good manage kitchen.,0.01
2594,Process,Mild,5,COVID-19,Heavy air letter feeling must treat must exactly institution.,0.11
2595,Perform,Severe,13,Cold,Color during front present million miss eight financial if particular even avoid.,0.02
2596,Before,Mild,5,Asthma,Require heavy sort perform history my major tend drug base reduce partner together.,0.13
2597,Writer,Mild,13,Bronchitis,Become nor sign career society what respond.,0.11
2598,Old,Severe,14,Flu,Over friend woman long industry soon none.,0.02
2599,Town,Moderate,11,Asthma,Than sell history every purpose collection customer happen.,0.07
2600,Mrs,Severe,14,Bronchitis,Street event building probably quickly town adult daughter rate agree base opportunity.,0.13
2601,Sound,Mild,11,Allergies,Everybody nor improve quality tree simply dream spend production information.,0.11
2602,General,Severe,2,Flu,Chair others push run fly and learn trade certainly work again audience organization.,0.13
2603,Family,Moderate,5,Bronchitis,Individual growth rich director yet maintain industry sea those.,0.05
2604,Western,Severe,14,COVID-19,Fire guess notice protect issue share person every blue unit law item allow simply.,0.07
2605,Practice,Mild,1,Flu,Same else out receive sea need live.,0.12
2606,Than,Mild,6,Bronchitis,Focus establish employee possible poor level town stop program fear.,0.01
2607,End,Severe,6,Asthma,Now better candidate development class couple never know school must.,0.12
2608,Same,Severe,1,Bronchitis,Example left reality style science tough money film actually official magazine.,0.11
2609,Through,Moderate,5,Cold,Military buy almost focus camera fear.,0.07
2610,Church,Mild,12,COVID-19,Board anything unit many late newspaper consider interesting either.,0.07
2611,Probably,Moderate,9,Cold,Arrive mean decade although control way reach key significant pattern list.,0.05
2612,Mention,Severe,7,Cold,Send sound participant hotel fight population specific.,0.06
2613,Buy,Severe,2,Flu,Glass sign accept huge myself door night continue total member include south.,0.13
2614,Man,Moderate,12,Cold,Natural old lose executive happen mouth eight.,0.11
2615,Professional,Severe,9,Allergies,Sister meet movie manage through bring.,0.13
2616,Hot,Mild,1,Bronchitis,Sure building forward good reveal artist sea fact water story situation company.,0.09
2617,Always,Mild,2,Cold,Past whom particular science energy morning discussion forward modern here campaign magazine.,0.09
2618,Dinner,Mild,5,Allergies,Prevent as list fine foot think newspaper.,0.06
2619,Agreement,Severe,5,Bronchitis,Different charge majority Mr entire business future kid send set interest history.,0.06
2620,International,Moderate,8,Cold,Themselves him indeed beat herself major old probably positive main six before free.,0.02
2621,Nearly,Moderate,12,COVID-19,Interesting difference there size deal Democrat hot relationship travel conference explain leave grow.,0.1
2622,Source,Severe,14,Bronchitis,After something charge age machine main onto lead serious member.,0.05
2623,Break,Moderate,1,Asthma,Fly become peace its difficult fly idea few foreign international million.,0.02
2624,Low,Moderate,13,Asthma,Agree various of kind together appear bed every wish response discuss region.,0.03
2625,Pull,Severe,1,Bronchitis,Ask year past occur significant meeting share.,0.04
2626,Huge,Moderate,8,Allergies,Move seven financial edge camera full claim child challenge feel thus race.,0.08
2627,Nothing,Mild,10,Allergies,Anyone social fish behind recognize white Republican look figure baby.,0.11
2628,Feel,Moderate,14,Allergies,Adult political four budget rule cold.,0.03
2629,Face,Severe,7,Asthma,Return window through half election follow.,0.14
2630,Year,Moderate,13,Flu,Quite employee near go moment tree person opportunity safe especially able raise out.,0.08
2631,Mouth,Moderate,11,COVID-19,Yard this administration simply any unit subject subject cell start fast reduce health.,0.03
2632,Clearly,Moderate,13,Bronchitis,Defense house of type TV detail religious chair.,0.05
2633,Event,Severe,14,Flu,Son bad black tonight painting answer management full without they.,0.02
2634,Million,Mild,4,COVID-19,Girl tax hospital market true agent marriage up protect stop fund again.,0.15
2635,Herself,Moderate,2,Allergies,Process point interview all structure down single goal guy TV career.,0.06
2636,Modern,Moderate,4,Flu,Product image know everyone charge represent.,0.13
2637,Letter,Severe,11,Flu,Late media short onto find think use woman than front hope sign central.,0.14
2638,While,Severe,10,Bronchitis,Official onto radio provide firm it style.,0.09
2639,Blood,Severe,11,COVID-19,Necessary sister address act purpose by phone claim.,0.14
2640,Campaign,Mild,1,Asthma,Country key put science as be with tell.,0.04
2641,Receive,Moderate,9,Flu,Class customer fall show garden major same police likely decide if.,0.09
2642,Door,Severe,3,Allergies,Play else direction rise guess plan determine her number bit argue.,0.12
2643,Husband,Mild,2,Flu,Bit us possible ground quickly say attorney travel herself soon.,0.07
2644,Likely,Mild,6,Cold,Free last Democrat approach direction site.,0.09
2645,That,Mild,7,Allergies,Site total difficult bar least enjoy.,0.08
2646,Ago,Severe,9,Allergies,Western report enjoy agent whole party special simply month.,0.05
2647,Everybody,Severe,6,Asthma,Federal while ten true him hard boy.,0.1
2648,Property,Moderate,10,Flu,Begin large career must participant step increase.,0.12
2649,Finally,Severe,3,Asthma,Area four term tough raise whom detail along have station business whole.,0.05
2650,These,Severe,8,Cold,Piece audience win effect few reach.,0.03
2651,Everyone,Mild,13,Cold,Network front might always table charge put church together travel.,0.12
2652,Check,Severe,11,Allergies,System focus everybody most Mrs something make wind including step whether news necessary.,0.12
2653,Reach,Mild,2,Bronchitis,Find treatment left drop sea use section today.,0.02
2654,Possible,Moderate,6,Flu,Note issue building live radio country smile.,0.13
2655,Song,Severe,9,Asthma,Give pressure physical point still cover agent fast pressure.,0.13
2656,Article,Moderate,10,Cold,Most stock boy management out official phone edge.,0.03
2657,Environmental,Mild,7,Allergies,Themselves structure listen scene weight left grow good compare writer purpose.,0.06
2658,Sea,Mild,11,COVID-19,Society life through seat short what recognize other visit.,0.04
2659,Chance,Moderate,1,Flu,Bill food her century seem painting community look.,0.11
2660,Short,Moderate,7,Allergies,Report away interest American field minute industry imagine.,0.02
2661,Man,Mild,14,Flu,Beautiful particular project enjoy marriage knowledge drop order huge manage media treatment.,0.06
2662,Program,Mild,8,Cold,Play very adult buy available red fall share interest.,0.1
2663,Southern,Mild,7,Asthma,Change key somebody price go television officer per again kind less throw way.,0.12
2664,Argue,Severe,12,Asthma,Account ball necessary present rule live month sea TV source often of happy.,0.02
2665,Couple,Severe,3,Flu,Coach him risk head follow member my recognize building official main expert.,0.03
2666,Tax,Mild,12,Allergies,Shake degree theory possible stage color place financial.,0.14
2667,Still,Mild,6,Cold,Know again board career lot day news cell there standard away.,0.09
2668,Bed,Severe,9,Asthma,Build current store worker lawyer activity kid carry letter economic bar.,0.02
2669,Back,Severe,3,Bronchitis,Election certain bad already seat trouble.,0.05
2670,Most,Mild,14,Allergies,Thing military girl experience usually occur instead spring successful painting determine beautiful business.,0.1
2671,Born,Moderate,11,Asthma,Herself star high return hospital arrive tonight meet morning Congress but.,0.08
2672,System,Mild,8,COVID-19,Push collection his large bar small building model stuff stop.,0.14
2673,Phone,Moderate,13,Asthma,Me apply claim describe oil kid pattern exist sport just set remember parent.,0.02
2674,Theory,Moderate,3,Bronchitis,Serve dream administration work wife pick.,0.04
2675,Safe,Severe,2,Bronchitis,Almost writer across give perform learn upon night seek early ball remember.,0.03
